{
  "$schema": "http://json-schema.org/draft-04/schema#",
  "description": "LDP table-and-schema pairs with last-update information",
  "type": "array",
  "items": {
    "type": "object",
    "properties": {
      "tableName": {
        "type": "string",
        "description": "The name of a table within an LDP schema"
      },
      "tableSchema": {
        "type": "string",
        "description": "The name of the LDP schema containing the table"
      },
      "lastUpdate": {
        "type": "string",
        "description": "ISO-8601 timestamp of last update to the table"
      },
      "elapsedRealTime": {
        "type": "number",
        "description": "The number of seconds elapsed since the last update"
      }
    },
    "additionalProperties": false,
    "required": [
      "tableName",
      "tableSchema",
      "lastUpdate",
      "elapsedRealTime"
    ]
  }
}
